{
  "$schema": "https://json-schema.org/draft/2020-12/schema",
  "$id": "urn:courtside:security:exceptions:v1",
  "type": "object",
  "additionalProperties": false,
  "required": ["schemaVersion", "exceptions", "dependencyExceptions", "riskAcceptances"],
  "properties": {
    "schemaVersion": { "const": 1 },
    "exceptions": { "type": "array", "items": { "$ref": "#/$defs/scannerException" } },
    "dependencyExceptions": { "type": "array", "items": { "$ref": "#/$defs/dependencyException" } },
    "riskAcceptances": { "type": "array", "items": { "$ref": "#/$defs/riskAcceptance" } }
  },
  "$defs": {
    "nonEmpty": { "type": "string", "minLength": 1 },
    "date": { "type": "string", "pattern": "^[0-9]{4}-[0-9]{2}-[0-9]{2}$" },
    "timestamp": { "type": "string", "pattern": "^[0-9]{4}-[0-9]{2}-[0-9]{2}T" },
    "fingerprint": { "type": "string", "pattern": "^sha256:[a-f0-9]{64}$" },
    "scannerException": {
      "type": "object",
      "additionalProperties": false,
      "required": ["id", "scope", "scanner", "findingId", "target", "rationale", "owner", "compensatingControl", "expiresOn", "independentReview"],
      "properties": {
        "id": { "$ref": "#/$defs/nonEmpty" },
        "scope": { "$ref": "#/$defs/nonEmpty" },
        "scanner": { "$ref": "#/$defs/nonEmpty" },
        "findingId": { "$ref": "#/$defs/nonEmpty" },
        "target": { "$ref": "#/$defs/nonEmpty" },
        "rationale": { "$ref": "#/$defs/nonEmpty" },
        "owner": { "$ref": "#/$defs/nonEmpty" },
        "compensatingControl": { "$ref": "#/$defs/nonEmpty" },
        "expiresOn": { "$ref": "#/$defs/date" },
        "independentReview": { "type": "boolean" }
      }
    },
    "dependencyException": {
      "type": "object",
      "additionalProperties": false,
      "required": ["id", "identity", "affectedVersionRange", "owner", "reachabilityAnalysis", "riskAnalysis", "compensatingControl", "acceptedAt"],
      "anyOf": [
        { "required": ["reviewOn"], "properties": { "reviewOn": {} } },
        { "required": ["expiresOn"], "properties": { "expiresOn": {} } }
      ],
      "properties": {
        "id": { "$ref": "#/$defs/nonEmpty" },
        "identity": { "$ref": "#/$defs/nonEmpty" },
        "affectedVersionRange": { "$ref": "#/$defs/nonEmpty" },
        "owner": { "$ref": "#/$defs/nonEmpty" },
        "reachabilityAnalysis": { "$ref": "#/$defs/nonEmpty" },
        "riskAnalysis": { "$ref": "#/$defs/nonEmpty" },
        "compensatingControl": { "$ref": "#/$defs/nonEmpty" },
        "acceptedAt": { "$ref": "#/$defs/timestamp" },
        "reviewOn": { "$ref": "#/$defs/date" },
        "expiresOn": { "$ref": "#/$defs/date" }
      }
    },
    "riskAcceptance": {
      "type": "object",
      "additionalProperties": false,
      "required": ["id", "fingerprint", "owner", "rationale", "compensatingControl", "acceptedAt", "independentReview"],
      "properties": {
        "id": { "$ref": "#/$defs/nonEmpty" },
        "fingerprint": { "$ref": "#/$defs/fingerprint" },
        "owner": { "$ref": "#/$defs/nonEmpty" },
        "rationale": { "$ref": "#/$defs/nonEmpty" },
        "compensatingControl": { "$ref": "#/$defs/nonEmpty" },
        "acceptedAt": { "$ref": "#/$defs/timestamp" },
        "independentReview": { "type": "boolean" }
      }
    }
  }
}
